id,class,language,source,topic,year,title,text,url,
175,true,pt,webpage,society,2007,Polícia identifica autor de massacre na Virgínia,"Um atirador matou ao menos 30 pessoas em dois diferentes locais da Universidade Técnica da Virgínia, em Blacksburg (Virgínia), nesta segunda-feira, no pior ataque a tiros contra um campus universitário da história dos Estados Unidos. O agressor também morreu. Não ficou claro se ele foi morto por policiais ou se se suicidou após o ataque. O presidente George W. Bush disse estar horrorizado com o ocorrido, segundo a Casa Branca. ""Hoje a universidade foi atingida por uma tragédia que consideramos de proporções monumentais"", afirmou o presidente da escola, Charles Steger. ""Estamos chocados"". Os dois ataques, que ocorreram em lados opostos do campus de 1.050 hectares, tiveram início às 7h15 (8h15 de Brasília) em West Ambler Johnston Hall, residência estudantil que abriga ao menos 895 pessoas. Pouco depois, Norris Hall, edifício da engenharia, foi alvo de outro ataque a tiros. A maioria dos mortos eram estudantes da universidade. Um deles foi morto em um dormitório e outros foram assassinados dentro de uma sala de aula, segundo o chefe de polícia do campus, W. R. Flinchum. O nome do homem armado não foi divulgado, tampouco se ele era estudante da escola. Antes desta segunda-feira, o pior ataque contra um campus da história dos EUA havia ocorrido em 1966 na Universidade do Texas, quando Charles Whitman subiu em uma torre de observação de 27 andares e abriu fogo. Ela matou 16 pessoas antes de ser baleado e morto. Após os ataques a tiros, todas as entradas do campus foram fechadas, e as aulas foram suspensas. A universidade estabeleceu um local de encontro entre famílias e representantes estudantis. Uma reunião deve ocorrer nesta terça-feira na quadra de basquete da escola. ""Há forte comoção. É difícil dizer exatamente o que está acontecendo"", disse Jason Anthony Smith, 19, que mora no dormitório onde um dos ataques a tiros ocorreu. Segundo Aimee Kanode, aluna do primeiro ano, o primeiro ataque ocorreu no primeiro andar do West Ambler Johnston, um andar acima do quarto em que ela dorme. ""Eles [a universidade] nos trancaram temporariamente nos quartos"", afirmou. ""Ficamos todos trancados nos quartos e acessando a internet para tentar saber o que acontecia"". A Universidade de Tecnologia da Virgínia tem 26 mil estudantes e fica a 390 km de Washington. É a segunda vez em menos de um ano que a universidade, que abriga 26 mil alunos, teve de ser fechada devido a um tiroteio. Em agosto de 2006, o reinício das aulas foi suspenso e a entrada no campus foi bloqueada depois que um fugitivo matou um segurança e um policial envolvidos em uma perseguição ocorrida em um ponto próximo da universidade. ",https://www.bbc.com/portuguese/reporterbbc/story/2007/04/070417_tiroteiocoletiva_is,
176,true,pt,webpage,political,2022,Ministros apontam diferença de tom no JN de Bolsonaro para Ciro,"Melhoraram microfone, luz, tom de voz, o roteiro está ameno, sem agressividade, sem ironias, sem caretas e sem interrupções', disse o ministro Fabio Faria. Os ministros da Casa Civil, Ciro Nogueira (PP-PI), e das Comunicações, Fábio Faria (PP-RN), apontaram diferenças na condução e até na qualidade da gravação nas entrevistas realizadas, nessa segunda-feira (22/8), com o presidente Jair Bolsonaro (PL), e nesta terça-feira (23/8), com Ciro Gomes (PDT), no ""Jornal Nacional"", da TV Globo. Nogueira, um dos principais apoiadores do governo, foi às redes sociais parabenizar o programa pela ""excelente condução da entrevista"" com Ciro Gomes, mas ironizou dizendo que o mesmo tratamento ""não foi possível com o presidente Bolsonaro"". Também nas redes sociais, Faria disse que o apresentador William Bonner ""não esqueceu Bolsonaro"", pois, segundo ele, as perguntas para o pedetista foram feitas para ""falar inverdades do governo"". A ambientação também não escapou das observações do ministro da Comunicação.""Melhoraram microfone, luz, tom de voz, o roteiro está ameno, sem agressividade, sem ironias, sem caretas e sem interrupções"", afirmou.","https://www.em.com.br/app/noticia/politica/2022/08/23/interna_politica,1388558/ministros-apontam-diferenca-de-tom-no-jn-de-bolsonaro-para-ciro.shtml?utm_source=hardnews&utm_medium=hardnews&utm_campaign=score&utm_term=undefined",
177,true,pt,webpage,political,2007,Oposição tenta obstruir votação da prorrogação da CPMF até 2011,"Oposição tenta obstruir votação da prorrogação da CPMF até 2011. O presidente da Câmara, Arlindo Chinaglia (PT-SP), marcou para hoje a votação da PEC (Proposta de Emenda Constitucional) que prorroga a cobrança da CPMF (Contribuição Provisória sobre Movimentação Financeira) até 2011 e mantém a alíquota de 0,38%. A discussão sobre a proposta já foi aberta e a intenção do governo é votar a prorrogação da cobrança do chamado imposto do cheque ainda hoje. No entanto, deputados de oposição tentam obstruir a votação para adiar a aprovação da prorrogação da PEC da CPMF. O PSDB e o DEM, por exemplo, já apresentaram requerimentos pedindo o adiamento da discussão sobre a proposta de prorrogação da CPMF por dez e nove sessões, respectivamente. Mas o primeiro vice-presidente da Câmara, deputado Narcio Rodrigues (PSDB-MG), informou aos dois partidos que há previsão regimental para esses pedidos. A votação, para valer, deve ser iniciada somente a partir das 16h desta quarta-feira. Como o governo tem maioria na Câmara, a expectativa é que a PEC da CMPF seja votada ainda hoje. O PT e PMDB têm, juntos, 174 deputados. O PR e o PP --que também integram a base de apoio-- também têm mais 81 deputados. O PSDB e o DEM --partidos de oposição-- somam 117 parlamentares na Câmara. O Planalto trabalha para aprovar a PEC sem alterações. Mantida a alíquota de 0,38%, a cobrança da CPMF deve render aos cofres públicos cerca de R$ 39 bilhões no próximo ano. Para ser aprovada, a PEC da CPMF precisa ser votada em dois turnos da Câmara. Em cada um dos turnos, precisa de 308 votos favoráveis. O intervalo entre a primeira e a segunda votação é de cinco sessões. Da Câmara, a PEC segue para o Senado --onde também precisa ser aprovada em dois turnos. Para limpar a pauta da Câmara e garantir a votação da PEC da CPMF, o governo decidiu revogar três das quatro MPs (medidas provisórias) que estavam com o prazo de aprovação vencido. A quarta MP foi aprovada nesta madrugada e prevê a concessão de mais R$ 6 bilhões para vários órgãos do Executivo --para ações do PAC (Programa de Aceleração do Crescimento). Foram revogadas as MPs que concediam descontos em impostos, como PIS/Pasep e Cofins, para os setores calçadista e moveleiro/ a que altera o registro, a posse e a comercialização de armas; e a que define a cobrança de um tributo para os comerciantes que compram e vendem mercadorias oriundas do Paraguai. Reportagem de hoje da Folha informa que a revogação da medida provisória que estendeu até dezembro o prazo para regularização do registro das armas de fogo coloca na ""ilegalidade"" 14 milhões delas, segundo o deputado Pompeo de Mattos (PDT-RS) --relator do projeto que transformaria em lei a Medida Provisória do Estatuto do Desarmamento.",https://www1.folha.uol.com.br/paywall/login.shtml?https://www1.folha.uol.com.br/poder/2007/09/329713-oposicao-tenta-obstruir-votacao-da-prorrogacao-da-cpmf-ate-2011.shtml?mobile,
178,true,pt,webpage,political,2007,Jobim decide realizar reforma definitiva na pista de Guarulhos,"RIO - O ministro da Defesa, Nelson Jobim, decidiu que será realizada uma reforma definitiva na pista principal de Guarulhos, o mais rápido possível, de acordo com a assessoria do ministério da Defesa. Fica afastada, portanto, a alternativa cogitada na semana passada, de se efetuar uma reforma emergencial nesse momento e se iniciar a reforma definitiva apenas em março de 2008. De acordo com estudos apresentados pela Infraero, será possível realizar a obra definitiva em três etapas, sem que seja necessário fechar a pista neste momento. O cronograma da obra depende de estudos finais que estão sendo realizados pela Infraero. Na primeira etapa, será reformado um terço da pista, em uma das cabeceiras, ficando o restante disponível para pousos e decolagens. Na segunda etapa, a parte concluída será reaberta e a obra passará a ser feita na outra cabeceira. A partir de março, será iniciada a fase final da obra, com a reforma do trecho central. Quando isso ocorrer, a pista deverá ser fechada, e os vôos que a utilizariam serão transferidos para o Aeroporto de Viracopos (Campinas). De acordo com a assessoria do ministério, a transferência dos vôos de Guarulhos para Viracopos não poderá ser feita neste momento, por que o aeroporto de Campinas necessitará de ampliação, principalmente em terminal de passageiros. Mas essa ampliação deverá estar concluída até março, sendo feita simultaneamente à reforma de Guarulhos.",jb.com.br/pais/noticias/2007/08/06/jobim-decide-realizar-reforma-definitiva-na-pista-de-guarulhos.html,
179,true,pt,webpage,political,2022,6 meses da Guerra na Ucrânia em 6 mapas: entenda a estagnação da invasão da Rússia," Tropas em Donetsk e Luhansk demonstram cansaço e dificuldade em avançar sobre o território ucraniano. Rússia busca obter controle administrativo sobre as regiões invadidas. No dia 24 de fevereiro -- há 6 meses, portanto -- começou o que o Kremlin chama de “operação especial” na Ucrânia, mas que o resto do mundo identificou como uma guerra ou invasão daquele país. Com a alegação inicial de que queria “desnazificar” o território vizinho, tropas russas bombardearam dezenas de alvos militares e civis em praticamente todo o território ucraniano, diante de uma comunidade internacional talvez já não surpresa com a agressão, mas ainda assim estupefata pela amplitude da ação. A superioridade militar russa era esperada, já que há anos Moscou exibia seus ""músculos"" em grandes desfiles e exibições de equipamentos bélicos. No entanto, o rumo tomado pela operação em seguida parece não ser o esperado pelos generais de Vladimir Putin, como se verifica nos seis mapas a seguir. A invasão começou em um ritmo acelerado e, no final do primeiro mês, a Rússia havia dominado porções importantes e o mapa da guerra estava assim: (imagem). Depois, veio um longo período de estagnação que se mantém até hoje. Após diversas investidas frustradas para dominar grandes cidades, como a capital Kiev e Kharkiv, tropas russas concentraram o foco da batalha no leste ucraniano e o mapa de domínio russo está praticamente igual desde abril: (imagem). ",https://g1.globo.com/mundo/ucrania-russia/noticia/2022/08/24/6-meses-da-guerra-na-ucrania-em-6-mapas-entenda-a-estagnacao-da-invasao-da-russia.ghtml,
180,true,pt,webpage,society,2007,Aeroportos têm mais de 28% dos vôos atrasados,"RIO - Esta terça-feira começou com atrasos e cancelamentos no aeroporto de Congonhas, zona Sul de São Paulo. Passageiros ainda enfrentam transtornos nos principais aeroportos do país, pelo quarto dia consecutivo. De acordo com a Empresa Brasileira de Infra-Estrutura Aeroportuária (Infraero), 30 vôos foram cancelados das 57 partidas programadas, até 09h, e dois com atraso superior a 1h. Congonhas só abriu para pousos, às 8h50. O aeroporto este fechado devido ao mau tempo. A TAM cancelou nesta terça-feira 68 vôos e desviou 22 para Guarulhos. As informações da Infraero não batem com as do painel das companhias aéreas, são 20 partidas atrasadas e 24 pousos atrasados. Há pouco, primeiro avião a pousar em Congonhas foi da GOL. O Aeroporto Internacional de São Paulo (Cumbica), em Guarulhos, opera visualmente neste início de manhã. Às 6h25, cinco chegadas e duas partidas estavam atrasadas. Segundo balanço da Infraero, das 26 partidas programadas da meia-noite às 6h, duas tiveram atrasos superiores a uma hora. O aeroporto Internacional Tom Jobim, na Ilha do Governador, Zona Norte do Rio, está aberto para pouso e decolagens, mas operando por instrumentos na manhã desta terça-feira. Segundo a Infraero, até às 8h havia registros de 21 vôos atrasados e de 16 cancelamentos. O saguão do aeroporto está cheio, com filas longas nos balcões das companhias aéreas. A madrugada foi de muita irritação no Tom Jobim, com muitos passageiros dormindo pelo chão do terminal. Passageiros de um vôo que deveria sair dia 17 para Belém ainda aguarda a autorização para partida da aeronave. Em Confins, na Região Metropolitana de Belo Horizonte, Minas Gerais, cinco vôos - entre partidas e chegadas - tiveram atrasos nesta manhã e apenas um foi cancelado. Já no aeroporto Salgado Filho, em Porto Alegre, a madrugada foi marcada pelas filas e falta de informações para os mais de cinco atrasos e dois cancelamentos.",https://www.jb.com.br/pais/noticias/2007/07/24/aeroportos-tem-mais-de-28-dos-voos-atrasados.html,
181,true,pt,webpage,society,2007,Fabiana Murer é ouro no salto com vara; 29. para o Brasil.,"A brasileira Fabiana Murer conquistou o primeiro ouro do atletismo para o Brasil, nesta segunda-feira, na prova de salto com vara. Com a marca de 4m60, Fabiana não só venceu a prova, como também estabeleceu o novo recorde pan-americano, 20cm mais alto do que a antiga marca de 4m40. Após confirmar a medalha de ouro, Fabiana tentou, ainda, bater o próprio recorde sul-americano de 4m66 em três tentativas de saltar 4m68, mas não conseguiu. A medalha de prata ficou com a americana April Steiner, com a marca de 4m40 e o bronze foi para a cubana Yarisley Silva, com 4m30. A brasileira Joana Costa ficou com a quinta posição, com 4m20 e mostrou, mais uma vez, neste Pan do Rio, que a pressão de competir em casa pode prejudicar os atletas. Após começar muito bem, saltando com segurança até os 4m, Joana começou a ter problemas na corrida de aproximação já nos 4m10, mostrando nervosismo e até desistindo de saltos no meio do caminho. Outros atletas brasileiros já sentiram essa pressão da torcida, como foi o caso das meninas do vôlei, que entregaram o ouro a Cuba, no tie break e dos atletas da ginástica artística, que cometeram seguidos erros, claramente, por nervosismo.","https://esportes.estadao.com.br/noticias/geral,fabiana-murer-e-ouro-no-salto-com-vara-29-para-o-brasil,23679",
182,true,pt,webpage,society,2007,"Sob mira do furacão, brasileiros se preparam para ir para abrigos em Cancún","Os brasileiros que estão em Cancún, um dos pontos turísticos mais visitados do México, estão se preparando para a chegada do furacão Dean, que já matou nove pessoas na região do Caribe. Segundo o músico César Kiles, que está hospedado com sua mulher no Hotel Oasis, os turistas receberam orientação para se dirigirem para o abrigo subterrâneo do hotel caso o furacão passe pela região. Soubemos do furacão anteontem, pela televisão. O hotel passou um informe avisando que talvez a gente tenha de ir para um abrigo que fica aqui embaixo, disse Kiles, em entrevista por telefone ao G1. Ele está em Cancún para passar a lua-de-mel com sua mulher, Aline, e disse que ainda não viu muitos indícios do furacão Dean. Por enquanto, o tempo está bom. Só o mar que está um pouco agitado, tem um pouco mais de onda, contou. César disse que ficará em Cancún até o próximo sábado e não está preocupado com a possibilidade de o furacão estragar sua viagem. Não estou preocupado, não. Temos esperança de que tudo vai dar certo. O pessoal aqui está acostumado com furacões, então eles devem tirar isso de letra, concluiu o músico. O furacão Dean também está provocando transtornos para os brasileiros que vivem na Ilhas Caymans, que ficam entre a Jamaica e Cuba. Segundo o brasileiro Thiago Brandão da Cunha, há muita chuva e vento, e o governo decretou toque de recolher desde as 10h da manhã de domingo (19). É muito vento, chuva e algumas partes da cidade já estão alagadas. A orientação que recebemos é para ficar em casa ou procurar os abrigos públicos, disse o brasileiro, em entrevista por telefone ao G1. Ele mora há quatro anos na Grand Cayman (uma das ilhas do arquipélago) e já sentiu na pele as conseqüências de um grande furacão. Em 2004, o (furacão) Ivan passou por aqui e foi assustador. A sensação é que você vai morrer. Naquela ocasião, o telhado da minha casa voou e ficamos numa parte pequena da sala onde sobrou um pouco do teto. Perdi roupas, equipamentos eletrônicos... é uma destruição total, é absurdo, contou Thiago, que é o técnico da seleção feminina de futebol local.","https://g1.globo.com/Noticias/Mundo/0,,MUL90869-5602,00-SOB+MIRA+DO+FURACAO+BRASILEIROS+SE+PREPARAM+PARA+IR+PARA+ABRIGOS+EM+CANCUN.html",
183,true,pt,webpage,society,2007,"Brasil acorda na etapa final, dá show com olé e goleia o Equador","RIO - Na volta da Seleção Brasileira ao Maracanã, os jogadores não decepcionaram e o Brasil goleou o Equador por 5 a 0, com direito a golaço, jogada bonita, show de dribles e frango do goleiro adversário. Os mais de 80 mil torcedores que lotaram o estádio fizeram uma linda festa e aplaudiram muito os craques, principalmente Kaká, autor de dois gols, Ronaldinho, que fez um, e Robinho, que deu passe para outro, após lindíssima jogada. Vágner Love e Elano completaram a goleada. Como era de se esperar, o Equador começou a partida muito fechado. O Brasil tocava a bola devagar e errava muitos passes. A primeira jogada só saiu aos nove minutos, após boa triangulação entre Kaká, Vágner Love e Robinho, que chutou par fora. Aos 14, Juan lançou do campo de defesa, a zaga falhou e Love acertou a trave. Quatro minutos depois, aos 18, o Brasil, finalmente fez a primeira jogada com cara de Brasil. Robinho deu um lindo toque para Maicon que deu um drible da vaca no adversário e cruzou na medida para Love abrir o placar. Um bonito gol. Aos 30, Robinho arriscou de longe e obrigou o goleiro Viteri a fazer boa defesa. A última chance de gol no primeiro tempo veio dos pés de Ronaldinho, em cobrança de falta que passou muito perto da trave. A Seleção voltou para a segunda etapa com vontade de abrir o placar e logo aos três minutos Kaká soltou uma bomba e o goleiro equatoriano se atrapalhou todo para defender. Aos seis, Ronaldinho bateu outra falta e Vieri foi bem na bola, salvando o Equador. Um minuto depois, o craque do Braça deu um lindo drible no equatoriano e levou a torcida ao delírio. Aos 12, Castillo bateu falta de longe e a bola passou perto do gol do Goleiro Júlio César, não teve quase nenhum trabalho na partida. No lance seguinte, Vágner Love arriscou da entrada da área e quase fez o segundo. Aos 19, novamente Love quase ampliou. Kaká fez excelente jogada na direita e virou o jogo para Robinho na esquerda. Maicon fez a ultrapassagem e cruzou para o camisa nove, que cabeceou por cima do gol. Um minuto depois Ronaldinho fez linda jogada e colocou Love na cara do gol, mas o atacante, novamente, concluiu para fora. Apesar de jogar melhor e dominar a partida, o Brasil não conseguia o segundo gol e o Equador começou a acreditar que dava para empatar e estragar a festa. Pura ilusão dos equatorianos. Aos 27, Kaká arriscou de muito longe e Ronaldinho colocou o desviou o chute. A bola que aparentemente iria para fora, mudou de direção e foi parar no fundo da rede. Cinco minutos depois, aos 31, Kaká fez o gol mais bonito da partida. Ele chutou de fora da área, colocado, e acertou o ângulo. Indefensável! A bola fez uma curva impressionante e o craque do Milan foi saudado com os gritos de Ah! Melhor do mundo!. Quando todos achavam que o gol de Kaké tinha sido o grand finale, Robinho fez uma jogada magnífica, a mais bonita do jogo, com cara de Brasil. A 20cm da linha de fundo ele deu dois dribles humilhantes no zagueiro equatoriano e cruzou para Elano, que fez o quarto, aos 37. Ainda cabia mais, já que o goleirão Vieri, que vinha fazendo boa partida, resolveu ajudar. Aos 39, Kaká Chutou fraco e o camisa 1 tomou um frango histórico. O detalhe é que, quando viu a bola entrar, ele olhou com cara de surpresa e não comemorou o gol. Ao final do jogo, o craque explicou o que aconteceu: - Vi que o chute tinha saído fraco e virei de costas. Aí vi a torcida comemorando e não entendi nada  falou, ainda no campo.",https://www.uol.com.br/esporte/futebol/ultimas/2007/10/17/ult59u133979.jhtm,
184,true,pt,webpage,society,2007,Brasil vence Polônia e enfrenta Rússia na final da Liga Mundial,"KATOWICE (Polônia) - A seleção brasileira de vôlei voltou a fazer bonito, desta vez na final da Liga Mundial, disputada contra a Rússia neste domingo no ginásio de Spodekna, em Katowice, na Polônia. O placar da partida foi de 3 sets a 1, com parciais de 18/25, 25/23, 28/26 e 25/22. Com a vitória, a seleção de Bernardinho conquistou seu quinto título consecutivo e o sétimo no total, na Liga Mundial. Em 2008, quando a Liga será disputada em Roma, a seleção brasileira tem a chance de, na casa do adversário, igualar a Itália em número de títulos da Liga, conquistando o octacampeonato. De 2001 para cá, a seleção brasileira chegou a todas as finais, só perdendo em 2002, justamente para a Rússia. E agora com mais esse título na bagagem, a seleção chega ainda com mais moral para disputar o ouro nos Jogos Pan-Americanos. Os Estados Unidos, por sua vez, derrotaram a Polônia por 3 sets a 1 e garantiram a terceira posição da Liga Mundial. A equipe americana venceu com parciais de 25/19, 25/21, 22/25 e 25/19. A equipe principal de vôlei dos EUA não alcança um pódio de competições de âmbito mundial desde 1992.",https://extra.globo.com/esporte/brasil-vence-polonia-enfrenta-russia-na-final-da-liga-mundial-699995.html,
185,true,pt,webpage,society,2007,Igreja paga multa recorde por abuso,"A Igreja Católica chegou a um acordo financeiro estimado em US$ 660 milhões (aproximadamente R$ 1,2 bilhão) com mais de 500 pessoas que alegam ter sido vítimas de abuso sexual por padres em Los Angeles, nos Estados Unidos. A informação foi divulgada pelo advogado das supostas vítimas, Ray Boucher, mas a indenização ainda tem que ser aprovada por um juiz. Este seria o maior pagamento já feito pela Igreja desde que surgiu o escândalo de abuso sexual envolvendo religiosos em 2002 e elevaria o total de indenizações pago pela Igreja desde 1950, nos Estados Unidos, a US$ 2 bilhões (R$ 3,7 bilhões). Em uma carta enviada recentemente a seus paroquianos, o cardeal Roger Mahony disse que Igreja venderia prédios administrativos e consideraria a venda de outras 50 propriedades para levantar fundos para o acordo. A diocese ainda não comentou o resultado das negociações, mas informou que integrantes da Igreja planejavam aparecer perante a corte na manhã da próxima segunda-feira. Uma das supostas vítimas no processo, Steven Sanchez, disse estar ao mesmo tempo aliviado e desapontado com o resultado. ""Eu estava emocionalmente pronto para levar a arquidiocese para a corte em menos de 48 horas, mas estou feliz que todas as vítimas vão receber uma compensação"", disse ele. ""Espero que as vítimas encontrem algum tipo de conforto nesse processo."" O advogado Ray Boucher disse que o acordo também pedia a divulgação de arquivos pessoais confidenciais dos padres. ""A transparência é parte fundamental disso"", disse Boucher. Para David Clohessy, diretor da Rede de Sobreviventes a Abusos Cometidos por Padres, apesar do valor recorde do acordo, dinheiro não era o objetivo principal das vítimas. ""Nunca é uma questão de dinheiro. As vítimas querem conforto, prevenção, conclusão, prestação de contas."" Desde 2002, cerca de mil pessoas entraram com ações contra a Igreja Católica só no estado americano da Califórnia. Em fevereiro de 2004, um relatório encomendado pela própria Igreja concluiu que mais de 4 mil padres católicos nos Estados Unidos tinham sido acusados de cometer abuso sexual nos últimos 50 anos.",https://www.otempo.com.br/brasil/igreja-paga-multa-recorde-por-abuso-1.278957,
