id,class,language,source,topic,year,title,text,url,
239,true,pt,webpage,covid19,2022,COVID: número de contaminados em Minas é o menor em 107 dias.,"Foram 469 casos da doença registrados pela Secretaria de Estado de Saúde (SES-MG) nas últimas 24 horas. Entre essa terça-feira (16/8) e hoje (17/8), foram registrados 469 novos casos de COVID-19 em Minas, o menor número em 107 dias, desde 2 de maio, quando foram registradas 210 infecções em 24 horas. As informações constam no boletim epidemiológico da Secretaria de Estado de Saúde (SES-MG), divulgado hoje. Também nas últimas 24 horas, mais 49 pessoas morreram em decorrência de complicações do novo coronavírus. Até o momento, desde o início da pandemia foram 3.858.977 casos confirmados e 63.330 óbitos. A curva do gráfico de média móvel de casos diários também aponta para uma queda, e hoje Minas está em 1.805 infecções por dia. Ontem (16/8), o número era de 2.349,6. De acordo com o vacinômetro, 90% dos mineiros receberam a primeira dose de vacina, e 84,7% a segunda. Já em relação às doses de reforço, 61% do público-alvo recebeu a terceira, e 35% recebeu a quarta dose de vacina contra a COVID. Belo Horizonte reforçou a convocação de crianças de 3 e 4 anos com imunossupressão a se vacinarem, mas a repescagem de todos os públicos que já foram chamados continua de segunda a sexta-feira nos centros de saúde indicados pela PBH no site. ","https://www.em.com.br/app/noticia/gerais/2022/08/17/interna_gerais,1387168/covid-numero-de-contaminados-em-minas-e-o-menor-em-107-dias.shtml",
240,true,pt,webpage,covid19,2022,"Atividade física parece limitar riscos vinculados à COVID, diz estudo. ","Não se trata de um estudo isolado, mas de uma análise que retoma e compila em torno de 15 trabalhos pré-existentes. As pessoas que praticam atividade física regularmente correm menos risco de se infectar com COVID e de desenvolver sintomas graves, conclui um estudo publicado nesta terça-feira (23/8), mas com limitações admitidas por seus próprios autores. ""Uma atividade física regular está associada a um menor risco de infecção"" ao coronavírus, assim como para um melhor prognóstico em questão de ""hospitalizações, gravidade e mortalidade"", diz o estudo publicado no British Journal of Sports Medicine. Já está bem estabelecido que uma boa atividade física favorece uma melhor resposta do organismo às doenças respiratórias em geral, mas este trabalho se concentra na COVID. Não se trata de um estudo isolado, mas de uma análise que retoma e compila em torno de 15 trabalhos pré-existentes. Os autores indicam que uma atividade física regular reduz ligeiramente o risco de infecção e, sobretudo, os de hospitalização (-36%) e de morte (-43%).","https://www.em.com.br/app/noticia/saude-e-bem-viver/2022/08/23/interna_bem_viver,1388295/atividade-fisica-parece-limitar-riscos-vinculados-a-covid-diz-estudo.shtml",
241,true,pt,webpage,covid19,2022,Jornal Nacional: Bolsonaro volta a defender tratamento ineficaz para COVID," Presidente e candidato à reeleição ainda culpou a imprensa por ter desestimulado a autonomia médica para prescrever medicamentos. Em entrevista ao Jornal Nacional na noite desta segunda-feira (22/8), o presidente  da República e candidato à reeleição, Jair Bolsonaro (PL), voltou a defender o chamado ‘tratamento precoce’ contra a COVID-19. Questionado pela jornalista Renata Vasconcellos sobre seu comportamento na condução da pandemia, ele culpou a imprensa por um ‘desestímulo’ à autonomia médica.O kit de tratamento precoce com medicamentos como ivermectina e cloroquina foi uma das principais bandeiras do governo durante a pandemia. Em resposta ao questionamento sobre a possibilidade de ser responsabilizado pela gestão do país durante períodos críticos da disseminação do coronavírus no país, Bolsonaro voltou a falar sobre a autonomia dos médicos para a prescrição de medicamentos e fez alusões a efeitos colaterais das vacinas. “O grande erro disso tudo foi um trabalho forte da grande mídia, dentre eles a Globo, desestimulando os médicos a fazer o tratamento precoce. Isso é conhecido como uma liberdade do médico. Quando algo é desconhecido, como até hoje é desconhecido alguns possíveis efeitos colaterais da vacina. Desaconselhar, inibir e ameaçar cassar o registro de médicos. Isso que foi errado durante a pandemia”, disse o presidente.","https://www.em.com.br/app/noticia/politica/2022/08/22/interna_politica,1388292/jornal-nacional-bolsonaro-volta-a-defender-tratamento-ineficaz-para-covid.shtml",
242,true,pt,webpage,covid19,2022,Servidores do 'fura-fila' da vacina de COVID-19 vão pagar indenização.,"Mesmo antes da hora, 31 servidores da Educação pegaram autorização para se vacinar contra COVID-19 em Passos. Os servidores investigados no esquema de fura-fila da vacina contra COVID-19 em Passos, Sudoeste de Minas, assinaram acordo e vão precisar pagar multa por conta da imunização. Dos 31 trabalhadores da SRE (Superintendência Regional de Ensino) de Passos que foram denunciados, 29 já firmaram o acordo com o Ministério Público. A Polícia Civil de Passos indiciou 31 pessoas com vínculo funcional na SRE-Passos por crimes de uso de documento falso/adulterado, falsificação de documento público e desobediência. O inquérito investigou um esquema de ‘fura fila’ que teria ocorrido em 18, 19 e 21 de junho de 2021. À época, o programa nacional de imunização contra a COVID-19, estabeleceu grupos prioritários para otimizar os recursos precários. Neste sentido, no mês de junho, iniciou-se a campanha para os profissionais da educação, entretanto, conforme as autoridades sanitárias, a vacina seria destinada para proteção da força de trabalho dos professores e funcionários que trabalham, diariamente, intramuros no ambiente escolar e com contato direto e habitual com alunos em sala de aula. O acordo de persecução penal foi formalizado pelo MP após as investigações sobre o caso. À época, estavam sendo vacinados prioritariamente os profissionais da Saúde e pessoas que pertenciam a outros pressupostos, a exemplo de comorbidades ou recorte etário. Não era a vez da Educação. Conforme as investigações, as pessoas teriam fraudado um formulário para se imunizarem pela superintendência. A multa para os servidores que assinaram o acordo vai de um salário mínimo e pode atingir valores entre R$ 4 mil e R$ 8 mil","https://www.em.com.br/app/noticia/gerais/2022/08/22/interna_gerais,1388277/servidores-do-fura-fila-da-vacina-de-covid-19-vao-pagar-indenizacao.shtml",
243,true,pt,webpage,covid19,2022,"Coronavírus pode ter surgido em grandes cidades poluídas, afirma estudo.","Pesquisa internacional investigou como surgem e se espalham os vírus da família coronavírus; padrão de desenvolvimento insustentável é determinante. O surgimento de novas espécies do coronavírus é mais frequente em grandes cidades, com alta densidade populacional, altos índices de poluição e padrões de desenvolvimento insustentáveis, indica um estudo de um grupo internacional de pesquisadores, com participação de professores da Univerdade Federal . A descoberta é inovadora, pois altera a percepção de que foram nas zonas rurais, de desmatamento recente, que o vírus surgiu. A pesquisa foi publicada na revista Environmental Microbiology no mês passado. O estudo, feito em escala global, observou a ocorrência e transmissão do coronavírus, levando em conta fatores como influência do tamanho da população humana de uma região, sua densidade, o índice de desenvolvimento econômico (IDH) do local, emissões de CO2, a precipitação total da região, a precipitação no mês mais seco, a área de remanescentes florestais e o desmatamento, segundo o professor Aristóteles Goés-Neto, professor do Departamento de Microbiologia da UFMG.","https://www.em.com.br/app/noticia/ciencia/2022/08/18/interna_ciencia,1387494/coronavirus-pode-ter-surgido-em-grandes-cidades-poluidas-afirma-estudo.shtml",
244,true,pt,webpage,covid19,2022,Até peixes vivos são testados para covid em meio a novo surto na China.,"Mídias sociais chinesas estão cheias de vídeos mostrando peixes e carangueijos sendo testados com testes PCR. Mais de cinco milhões de pessoas tiveram que ser submetidas a testes de covid-19 na cidade costeira de Xiamen, na China, depois que cerca de 40 casos do vírus foram detectados nesta semana.As pessoas não foram as únicas a serem testadas: um aviso oficial afirma que algumas formas de vida marinha também devem ser incluídas na onda de testes em massa.Nas últimas semanas, o comitê distrital de Controle de Pandemia Marítima de Jimei, em Xiamen, emitiu um aviso dizendo que, quando os barcos retornarem aos portos, ""tanto os pescadores quanto seus peixes e frutos do mar devem ser testados"". O resultado foi que, em meio a esse último surto, imagens de vídeo apareceram em várias plataformas de mídia social, incluindo a Douyin a versão local do TikTok na China mostrando profissionais de saúde fazendo testes do tipo PCR em peixes e caranguejos vivos. Embora isso possa parecer incomum, não é a primeira vez que peixes vivos são testados para covid-19. Um funcionário do Departamento Municipal de Desenvolvimento Oceânico de Xiamen disse ao jornal South China Morning Post que o governo aprendeu ""muitas lições"" de Hainan que está passando por um grave surto da doença.","https://www.em.com.br/app/noticia/internacional/bbc/2022/08/18/interna_internacional,1387473/ate-peixes-vivos-sao-testados-para-covid-em-meio-a-novo-surto-na-china.shtml",
245,true,pt,webpage,covid19,2022,Covid: os sintomas mais comuns causados por novas variantes,"De acordo com os dados de mais de 17 mil pessoas que disseram estar com a doença na última semana no Reino Unido, dor de garganta e dor de cabeça são os incômodos mais frequentes da doença.Dor de garganta, dor de cabeça, coriza e tosse são os principais sintomas que podem sugerir um quadro de covid-19.Essa é a conclusão de um relatório feito no Reino Unido que reuniu informações de 17,5 mil pessoas que testaram positivo na última semana. Os dados, obtidos por meio do aplicativo Zoe Covid, são analisados em parceria com pesquisadores do King's College, em Londres, com apoio do NHS, o sistema de saúde pública do país. O trabalho também descobriu que febre e perda de olfato ou paladar — que eram sintomas bem mais frequentes da infecção há alguns meses — se tornaram menos comuns agora.Outros incômodos, como voz rouca, espirros, cansaço e dores musculares, subiram no ranking dos sintomas da doença. Os 20 principais sintomas da covid-19, em ordem decrescente, de acordo com os dados do estudo Zoe App são: Dor de garganta - relatada por 58% dos participantes; Dor de cabeça - 49%; Nariz entupido - 40%; Tosse seca - 40%; Coriza - 40%; Tosse com catarro - 37%; Voz rouca - 35%; Espirros - 32%; Fadiga - 27%; Dores musculares - 25%; Náusea - 18%; Inchaço no pescoço (a popular ""íngua"") - 15%; Dor nos olhos - 14%; Alteração no olfato – 13%; Aperto ou dor no peito - 13%; Febre - 13%; Calafrios - 12%; Falta de ar - 11%; Dor de ouvido - 11%; Perda de olfato - 10%. As informações coincidem com os achados de outras pesquisas recentes.O estudo React-1, por exemplo, seleciona a cada mês cerca de 150 mil pessoas de forma aleatória na Inglaterra. Todas elas fazem testes rápidos de antígeno. Os resultados mais recentes da iniciativa mostram que os sintomas mais comuns da covid-19 se modificaram bastante ao longo da pandemia.",https://g1.globo.com/saude/noticia/2022/07/15/covid-os-sintomas-mais-comuns-causados-por-novas-variantes.ghtml,
246,true,pt,webpage,covid19,2022,Covid-19: UFJF torna facultativo o uso de máscara,"Medida aprovada pelo Conselho Superior ocorreu nesta quarta-feira (17). A instituição já havia liberado a utilização em maio, porém voltou a ser obrigatório em junho. O uso de máscaras foi flexibilizado na Universidade Federal de Juiz de Fora (UFJF). A medida aprovada pelo Conselho Superior (Consu) ocorreu nesta quarta-feira (17). A instituição já havia liberado o uso em maio, porém voltou a ser obrigatório em junho. De acordo com a UFJF, a medida foi aprovada após a divulgação da portaria municipal que torna menos rígida a utilização das proteções faciais em Juiz de Fora. O médico infectologista do Hospital Universitário (HU/UFJF/Ebserh), Rodrigo Daniel de Souza, ressaltou que foram usados critérios próprios da Instituição, baseados nas orientações do Centro de Controle de Doenças (CDC) dos Estados Unidos – referência sobre a conduta em caso de doenças infecciosas no mundo e aprovados pelo Conselho Superior (Consu). “Esses critérios são baseados nos números de novos casos de Covid-19 na cidade e no quantitativo de internações da última semana no município. Já nas últimas semanas tínhamos critérios para flexibilizar o uso de máscaras nos espaços da UFJF, mas como havia uma portaria municipal que obrigava o uso em determinados espaços, respeitamos a decisão e mantivemos a utilização nas dependências da Universidade”, enfatiza o infectologista. A UFJF ressaltou também que o ""Comitê segue acompanhando os dados da evolução da Covid-19 e mantém as orientações sobre as demais medidas de proteção"".",https://g1.globo.com/mg/zona-da-mata/noticia/2022/08/17/covid-19-ufjf-torna-facultativo-o-uso-de-mascara.ghtml,
247,true,pt,webpage,covid19,2022,OMS desaconselha uso de dois remédios para tratar Covid-19,"Colchicina e fluvoxamina tiveram recomendação de não serem usadas; entidade avaliou que as evidências reunidas até agora não justificam os usos dos remédios.A Organização Mundial de Saúde (OMS) divulgou, nesta quinta-feira (14), novas diretrizes desaconselhando o uso de dois remédios para tratar a Covid-19. As novas orientações foram publicadas no ""British Medical Journal"" (""BMJ""). A organização passou a desaconselhar o uso de colchicina e fluvoxamina para pacientes com Covid-19 leve ou moderada, porque não há evidências suficientes de que elas tragam melhoras para os pacientes. Além disso, ambas trazem riscos, apontou o Grupo de Desenvolvimento de Diretrizes da entidade. A nova orientação é que a fluvoxamina – um antidepressivo – seja usada apenas em ensaios clínicos. Já a colchicina – um anti-inflamatório usado para tratar gota – tem uma ""forte recomendação"" de não ser usada em casos leves e moderados de Covid. Em outubro do ano passado, um estudo na ""The Lancet"" havia apontado que a fluvoxamina poderia reduzir em até 32% as internações pela Covid-19. A OMS não emitiu diretrizes sobre o uso dos medicamentos em pacientes graves ou críticos (veja mais abaixo as recomendações atuais da entidade).",https://g1.globo.com/saude/coronavirus/noticia/2022/07/14/oms-desaconselha-uso-de-dois-remedios-para-tratar-covid-19.ghtml,
248,true,pt,webpage,covid19,2022,Mandetta sobre fala de Bolsonaro: 'O alertei sobre cada passo da epidemia',"Ex-ministro do presidente usou as redes sociais para se pronunciar, após ser citado em entrevista do Chefe do Executivo no Jornal Nacional. O ex-ministro da Saúde do presidente Jair Bolsonaro (PL), Luiz Henrique Mandetta (União-MS), usou as redes sociais para rebater as críticas do presidente ao ex-ministro, feitas no Jornal Nacional, na noite dessa segunda-feira (22/8). Em seu Twitter, Mandetta afirmou que alertou o presidente sobre os rumos da pandemia, no seu período de governo, ainda considerada epidemia. ""O alertei sobre cada passo da epidemia. 680.000 vidas nos separam. Fui citado. Tem direito de resposta?"", escreveu Mandetta em seu Twitter, se referindo às declarações que o presidente deu em entrevista, que criticavam o plano de combate à pandemia do ex-ministro. No Jornal Nacional, ao ser questionado pela jornalista Renata Vasconcellos sobre o episódio no qual imitou uma pessoa com falta de ar, o Chefe do Executivo sugeriu não ter tido tal atitude. Posteriormente ele declarou que estava ""denunciando o 'Protocolo Mandetta' e que sempre defendeu as pessoas"".","https://www.em.com.br/app/noticia/politica/2022/08/23/interna_politica,1388414/mandetta-sobre-fala-de-bolsonaro-o-alertei-sobre-cada-passo-da-epidemia.shtml",
249,true,pt,webpage,covid19,2022,Bolsonaro imitou sim pessoas com falta de ar: relembre quando foi,"Em entrevista no Jornal Nacional, presidente desafiou jornalista Renata Vasconcellos a exibir momentos em que ele imitou pessoas com falta de ar. Em entrevista ao Jornal Nacional, na noite dessa segunda-feira (22/8), o presidente Jair Bolsonaro (PL), ao ser questionado pela jornalista Renata Vasconcellos sobre o episódio no qual imitou uma pessoa com falta de ar, sugeriu não ter tido tal atitude. O Chefe do Executivo desafiou a jornalista a reproduzir um vídeo dele imitando a ocasião. Diferentemente do que Bolsonaro disse, ele imitou uma pessoa com falta de ar mais de uma vez. Em 18 de março de 2021, em uma de suas transmissões semanais nas redes sociais, o presidente criticou seu ex-ministro da Saúde, Luiz Henrique Mandetta (União-MS), e chegou a imitar uma pessoa com falta de ar. Na ocasião, Bolsonaro defendia o 'Kit COVID', composto por ivermectina, azitromicina e cloroquina, remédios sem eficácia comprovada para o tratamento da doença, e disse que, quem criticasse o ""tratamento inicial"" e sentisse os sintomas de coronavírus, procurasse um hospital, assim como Mandetta orientava.","https://www.em.com.br/app/noticia/politica/2022/08/23/interna_politica,1388390/bolsonaro-imitou-sim-pessoas-com-falta-de-ar-relembre-quando-foi.shtml",
250,true,pt,webpage,political,2022,Moraes determina buscas em endereços de empresários por supostas mensagens golpistas,"Mandados são cumpridos em cinco estados: São Paulo, Rio de Janeiro, Rio Grande do Sul, Santa Catarina e Ceará. Advogados e entidades pediram ao STF que empresários fossem investigados. O ministro Alexandre de Moraes, do Supremo Tribunal Federal (STF), determinou que a Polícia Federal cumpra mandados de busca e apreensão em endereços de oito empresários que compartilharam mensagens golpistas em um grupo em um aplicativo de mensagens. Os mandados são cumpridos nesta terça-feira (23) em cinco estados: São Paulo, Rio de Janeiro, Rio Grande do Sul, Santa Catarina e Ceará. Além das buscas, Alexandre de Moraes também determinou: bloqueio das contas bancárias dos empresários; bloqueio das contas dos empresários nas redes sociais; tomada de depoimentos; quebra de sigilo bancário. Mensagens reveladas pelo site ""Metrópoles"" mostram que empresários apoiadores do presidente Jair Bolsonaro (PL), candidato à reeleição, passaram a defender um golpe de Estado caso o ex-presidente Lula (PT), também candidato à Presidência, vença as eleições de outubro. Pesquisa Datafolha divulgada na semana passada mostrou Bolsonaro em segundo lugar, com 32% das intenções de voto, enquanto Lula aparece em primeiro, com 47% das intenções. São alvos da operação desta terça: Afrânio Barreira Filho (Coco Bambu); Ivan Wrobel (W3 Engenharia); José Isaac Peres (Multiplan); Luciano Hang (Havan); Luiz André Tissot (Sierra); Marco Aurélio Raymundo (Mormaii); Meyer Joseph Nigri (Tecnisa). Daniel Maia, advogado do empresário Afrânio Barreira, disse que a operação é ""fruto de perseguição política e denúncias falsas, as quais não têm nenhum fundamento"". Disse ainda que o cliente está ""absolutamente tranquilo e colaborando com a busca da verdade, a qual resultará no arquivamento da investigação"". A GloboNews e o g1 tentavam contato com a defesa dos demais empresários até a última atualização desta reportagem.",https://g1.globo.com/politica/noticia/2022/08/23/moraes-determina-buscas-em-enderecos-de-empresarios-por-supostas-mensagens-golpistas.ghtml,
251,true,pt,webpage,political,2022,Buscas contra empresários golpistas em dia de encontro de Moraes com ministro da Defesa irrita Planalto,"PF apura se investigados se juntaram para planejar e apoiar tentativa de ruptura do Estado Democrático de Direito. Entre os alvos está Luciano Hang, um dos mais ardorosos defensores de Bolsonaro.Interlocutores do presidente Jair Bolsonaro (PL) reagiram com irritação à operação da Polícia Federal realizada nesta terça-feira (23) contra empresários que defenderam, em grupo do WhatsApp, um golpe de estado em caso de vitória de Lula em outubro. As buscas foram determinadas pelo ministro do Supremo Tribunal Federal (STF) Alexandre de Moraes, que também é presidente do Tribunal Superior Eleitoral (TSE). Segundo uma fonte, a PF investiga se os empresários se juntaram para"" planejar e apoiar futuras tentativas de ruptura do Estado Democrático de Direito"", um crime previsto no Código Penal que tem pena de 4 a 8 anos de prisão. Um interlocutor do presidente trata como ""provocação"" as buscas contra Luciano Hang, dono da Havan e um dos empresários alvos da operação. O fato de a operação ocorrer no dia em que Moraes deve se reunir com o ministro da Defesa, Paulo Sérgio Nogueira, para tratar sobre as eleições aumentou a revolta. O encontro é visto pelo QG da reeleição como mais uma oportunidade para tirar gás dos ataques de Bolsonaro ao sistema eleitoral que, para os assessores, atrapalha os planos de reeleição do presidente. Segundo o blog apurou, entretanto, a decisão que embasa a operação foi tomada na sexta-feira da semana passada, 19 de agosto.",https://g1.globo.com/politica/blog/andreia-sadi/post/2022/08/23/operacao-contra-empresarios-golpistas-em-dia-de-encontro-de-moraes-com-ministro-da-defesa-irrita-planalto.ghtml,
252,true,pt,webpage,political,2022,"Documentos levados por Trump da Casa Branca eram secretos, diz jornal","Segundo jornal ""The New York Times"", ex-presidente pegou 300 papéis ao deixar governo, incluindo material da CIA, da Agência Nacional de Segurança e do FBI. Ao deixar a Casa Branca, o ex-presidente dos Estados Unidos, Donald Trump, levou cerca de 300 documentos secretos do governo norte-americano para sua residência pessoal, em Mar-a-Lago, afirma o jornal ""The New York Times"".Entre os papéis levados irregularmente por Trump, estão materiais da CIA - a agência secreta do país -, além de documentos do FBI - o serviço de inteligência - e da Agência Nacional de Segurança. Ainda segundo a publicação, a documentação foi parcialmente recuperada pelo governo norte-americano, após meses de negociações com assessores do ex-presidente. Citando fontes da investigação, o jornal diz que, através do diálogo, 150 documentos foram devolvidos em janeiro e uma outra quantidade em junho. A terceira parte dos papéis, que Trump não havia devolvido ainda, foi recolhida pelo FBI durante operação na casa do ex-presidente em Mar-a-Lago, na Flórida, no início de agosto. O Departamento de Justiça dos Estados Unidos ainda não havia se pronunciado sobre as alegações do ""New York Times"" até a última atualização desta notícia.",https://g1.globo.com/mundo/noticia/2022/08/23/documentos-levados-por-trump-de-casa-branca-eram-secretos-diz-jornal.ghtml,
253,true,pt,webpage,culture,2022,"Rosalía canta Elis Regina, faz o quadradinho e é ovacionada em estreia no Brasil","Cantora espanhola fez show único em São Paulo nesta segunda-feira (22) e mostrou por que é uma das artistas pop mais criativas em atividade.O barulho da plateia parecia de um show de boy band. O coro era tão alto que era difícil ouvir a voz da artista. O público berrava até as partes instrumentais e ia abaixo só de ver ela mascar chicletes ou botar óculos escuros. Rosalía estreou no Brasil sob essa comoção. A cantora espanhola fez um show único e lotado, para 8 mil pessoas, no Espaço Unimed (antigo Espaço das Américas) na noite desta segunda-feira (22). O melhor é que ela consegue isso sem ir pelo caminho fácil. O show é a cara das músicas dela: pop, vibrante e esquisito, fazendo certo por linhas tortas. O visual é impressionante, estiloso e simples. Entre as menções ao Brasil, ela cantou Elis Regina e Tom Jobim, fez a dança do funk do quadradinho, sambou e fez juras de amor ao pão de queijo. O show estava marcado para uma casa com capacidade para quatro mil pessoas, e teve que mudar para uma com o dobro do tamanho. Mesmo assim, os ingressos se esgotaram rapidamente. O show começou às 21h40 e durou quase duas horas. Ela cantou poucas dos dois primeiros álbuns, ""Los Ángeles"" (2017) e ""El mal querer"" (2018), e todas as faixas do aclamado ""Motomami"" (2022).",https://g1.globo.com/pop-arte/musica/noticia/2022/08/23/rosalia-canta-elis-regina-e-tom-jobim-faz-o-quadradinho-e-e-ovacionada-em-estreia-no-brasil.ghtml,
