id,class,language,source,topic,year,title,text,url,
1,false,pt,webpage,political,2017,"Kátia Abreu diz que vai colocar sua expulsão em uma moldura, mas não para de reclamar. ","Kátia Abreu diz que vai colocar sua expulsão em uma moldura, mas não para de reclamar. A senadora Kátia Abreu (sem partido-TO) disse que sua expulsão do PMDB foi resultado de uma ação da cúpula atual da legenda que, segundo ela, é oportunista.?Amanhã eu vou botar numa moldura dourada a minha expulsão, porque das mãos de onde veio, é um atestado de boa conduta para o meu currículo. Essas pessoas que me expulsaram não servem ao país. Eles se servem do país em seus benefícios próprios?, disse Kátia Abreu. Ué, mas se a expulsão é algo tão bom para seu currículo, por que tanta choradeira, Kátia? Sabemos o motivo. Provavelmente Kátia não tem valor para o PT, partido que já deveria tê-la absorvido. Ao que parece o PT gostava de Kátia somente se ela ficasse entrincheirada dentro do PMDB. Ou seja, isso é se rebaixar demais. Resta a Kátia ficar chorando as pitangas por todos os cantos. Em tempo: até o momento o PT não cadastrou Kátia Abreu em suas fileiras. Que situação patética para a ex-ministra da Agricultura de Dilma.",https://ceticismopolitico.com/2017/11/30/katia-abreu-diz-que-vai-colocar-sua-expulsao-em-uma-moldura-mas-nao-para-de-reclamar/,
2,false,pt,webpage,political,2017,Cara de pau não tem limites: Zé Celso aciona MP contra Silvio Santos.,"Cara de pau não tem limites: Zé Celso aciona MP contra Silvio Santos. O Teatro Oficina procurou o Ministério Público Federal (MPF) nesta terça-feira na tentativa de violar os direitos de Silvio Santos, que deseja erguer três torres residenciais de cem metros de altura cada uma. As informaç?es são da Veja.O empresário é dono dos terrenos em volta do teatro e executa seu direito de propriedade, negando-se a trocá-los por outros, oferta feita a ele pelo Ministério do Planejamento. O grupo teatral, que fez sua sede no local há cerca de sessenta anos e ocupa um prédio que leva a assinatura de Lina Bo Bardi (a mesma do Masp e do Sesc Pompeia), alega danos ao projeto da arquiteta, que prevê a contracenação com o bairro do Bexiga e a cidade através do janelão aberto em uma das paredes do edifício e inclui ainda um parque cultural, que ela não chegou a fazer por ter morrido antes de concluir a proposta. A procura pelo Ministério Público Federal é uma nova estratégia de desrespeito à propriedade privada feita pelo grupo teatral, depois que Silvio Santos deixou de aceitar as provocaç?es e rompeu o diálogo com a companhia. Em outubro, Silvio Santos reverteu decisão ainda de 2016 do Condephaat, o órgão estadual de proteção ao patrimônio público, que o impedia de construir em volta do Teatro Oficina. Agora, para levar seu projeto imobiliário adiante, busca o mesmo aval nos níveis municipal e federal. É por isso que João Doria pisou na bola ao ter feito uma reunião no passado com Zé Celso e Silvio Santos. Com gente que não respeita a propriedade privada, não deve haver diálogo. Que Silvio Santos vá pra briga, pois tem seus direitos de proprietário.",https://ceticismopolitico.com/2017/11/28/cara-de-pau-nao-tem-limites-ze-celso-aciona-mp-contra-silvio-santos/,
3,false,pt,webpage,political,2017,"Temer resolve o problema de Luislinda: liberdade, ainda que tardia.","Temer resolve o problema de Luislinda: liberdade, ainda que tardia.. A ministra dos Direitos Humanos Luislinda Valois entrou para a galeria dos sem noção ao pedir para acumular o salário da função de ministra com a aposentadoria de desembargadora, o que daria R$ 61 mil, muito além do teto constitucional. Ao fazê-lo, alegou que sua condição, sem sombra de dúvida, se assemelha a trabalho escravo. Agora o jornal carioca O Dia divulga que Temer decidiu demitir Luislinda e dar um fim ao seu problema. Ao que parece, o presidente ainda busca uma saída honrosa para Luislinda. Talvez outro cargo. Não sabemos ainda.Sua substituta deve ser a deputada federal licenciada Tia Eron (PRB), atual secretária municipal de Promoção Social.O que importa é que Luislinda, enfim, conseguiu sua liberdade. Ainda que tardia.",https://ceticismopolitico.com/2017/11/27/temer-resolve-o-problema-de-luislinda-liberdade-ainda-que-tardia/,
4,false,pt,webpage,political,2017,Palocci vai contar que Lula pagou propina a ex-presidente do Peru e aumentar a pressão sobre o petista.,"Palocci vai contar que Lula pagou propina a ex-presidente do Peru e aumentar a pressão sobre o petista.. O Radar Online divulga que em sua delação, Antônio Palocci vai confirmar o pedido para que a Odebrecht pagasse 3 milh?es de dólares a Ollanta Humala, ex-presidente do Peru, atualmente preso.Só que o ex-ministro tem informaç?es adicionais e vai dizer que a ordem veio diretamente de Lula, que, de fato, era o maior elo de ligação do poder com a empreiteira.A delação de Palocci segue sendo temida pelos petistas e panela de pressão pode explodir nos próximos meses.",https://ceticismopolitico.com/2017/11/25/palocci-vai-contar-que-lula-pagou-propina-a-ex-presidente-do-peru/,
5,false,pt,webpage,political,2017,Garotinho ganha prêmio após teatro sobre ?surra na cadeia?: vai para presídio de segurança máxima.,"Garotinho ganha prêmio após teatro sobre surra na cadeia: vai para presídio de segurança máxima.. O ex-governador do Rio de Janeiro Anthony Garotinho será transferido para um presídio de segurança máxima.O juiz Ralph Machado Manaes Júnior, do Tribunal Regional Eleitoral da 98a Zona Eleitoral do Rio de Janeiro, deu a decisão na tarde desta sexta (24) para o ex-governador ser transferido imediatamente do presídio de Benfica para um presídio federal de segurança máxima. As informaç?es são do O Globo.O juiz disse, em sua decisão, que Garotinho causando transtornos em Benfica e teria se autolesionado. Isso foi descoberto após Garotinho ter dito que foi agredido na cadeia durante a noite. O juiz recebeu essas informaç?es antes da queixa de Garotinho.Garotinho disse que tomou uma surra durante a noite dentro de sua cela na penitenciária de Benfica. O advogado do ex-governador disse que seu cliente relatou que uma pessoa invadiu a cela onde ele dormia e o agrediu com um porrete.Seja lá como for, se o problema é segurança, está resolvido. Agora ele vai para um lugar de segurança máxima.",https://ceticismopolitico.com/2017/11/24/garotinho-ganha-premio-apos-teatro-sobre-surra-na-cadeia-vai-para-presidio-de-seguranca-maxima/,
6,false,pt,webpage,political,2017,Raquel Dodge faz o que Janot não fazia: pediu a prisão da senadora petista Gleisi.,"Raquel Dodge faz o que Janot não fazia: pediu a prisão da senadora petista Gleisi. A procuradora-geral da República, Raquel Dodge, pediu a condenação da senadora petista Gleisi Hoffmann no âmbito da Lava Jato. Para a PGR, Gleisi cometeu crimes de corrupção passiva e lavagem de dinheiro.Detalhe: Dodge também quer que Gleisi devolva R$ 4 milh?es aos cofres públicos e perca o mandato.Abaixo estão as alegaç?es de Raquel Dodge:Ao que parece, com a saída do PGR Rodrigo Janot passou a fase em que havia motivação apenas para tentar prender senadores que fossem adversários do PT.Estamos exigindo a prisão de Gleisi Hoffmann há muito, mas muito tempo.",https://ceticismopolitico.com/2017/11/24/raquel-dodge-faz-o-que-janot-nao-fazia-pediu-a-prisao-da-senadora-petista-gleisi/,
7,false,pt,webpage,political,2017,Garotinho se supera no teatro ao chutar parede e fingir que foi lesionado na cadeia.,"Garotinho se supera no teatro ao chutar parede e fingir que foi lesionado na cadeia. O Globo noticiou que a Secretaria de Administração Penitenciária (Seap) informou à Vara de Execuç?es Penais (VEP) do Rio que Anthony Garotinho se autolesionou dentro de sua cela na Cadeia Pública José Frederico Marques, em Benfica, na Zona Norte do Rio.O sujeitinho disse que foi agredido durante a madrugada desta sexta-feira por uma pessoa que estava com um porrete.Bem, esse é o mesmo que deu teatro na maca meses atrás, em sua outra prisão, após a qual ele conseguiu liberdade.Bem, ele conseguiu se mostrar como o mais repugnante de todos os políticos presos só com essas duas atitudes.É uma figura assustadora em termos de fingimento. Psicopata é pouco pra descrever.",https://ceticismopolitico.com/2017/11/24/garotinho-se-supera-no-teatro-ao-chutar-parede-e-fingir-que-foi-lesionado-na-cadeia/,
8,false,pt,webpage,political,2017,Joesley chorou ao entrar na cela e está sem comer e tomar banho.,"Joesley chorou ao entrar na cela e está sem comer e tomar banho. O delator Joesley Batista chorou no momento em que os agentes abriram a cela da carceragem da superintendência da Polícia Federal em São Paulo para que ele entrasse após se entregar na tarde deste domingo.Ao ouvir o barulho da grade fechando ele começou a chorar compulsivamente e a tremer. Seus colegas de cela tentaram o consolar mas ele teve uma crise nervosa e precisou ser medicado. Optou por não tomar banho (frio) nem se alimentar (marmita). O carcereiro chegou a brincar com ele dizendo que o bife era de confiança, que era Friboi, mas ele sequer levantou a cabeça.A Coluna apurou que Joesley e o executivo da JBS Ricardo Saud devem ser transferidos para Brasília na segunda-feira, 10, em aeronave da Polícia Federal.Os dois foram presos por determinação do ministro Edson Fachin, do Supremo, atendendo a pedido do procurador-geral da República, Rodrigo Janot. Eles são acusados de omitir informaç?es no acordo de delação premiada. A prisão é temporária, com prazo de cinco dias prorrogáveis por mais cinco.",https://afolhabrasil.com.br/politica/joesley-chorou-ao-entrar-na-cela-e-esta-sem-comer-e-tomar-banho/,
9,false,pt,webpage,political,2017,Aécio chora muito e tem medo de ir para a cadeia. ,"Aécio chora muito e tem medo de ir para a cadeia. Ricardo Noblat, em sua coluna no Globo, informou que Aécio Neves chorou muito ao saber que a 1a turma do STF decidiu manter sua irmã, Andrea Neves, presa. Pessoas próximas do senador disseram que ele está inconformado e também com muito medo de ser preso. Na próxima quarta-feira (20), a mesma turma que decidiu manter Andrea presa julgará o pedido de prisão (feito pela PGR) contra Aécio Neves. Vale ressaltar que, caso o pedido seja aprovado, o Senado ainda terá que autorizar a prisão do parlamentar.Andrea Neves é considerada a mentora intelectual da carreira política do tucano e estava pronta para empreender fuga para a Inglaterra quando foi capturada pela Operação Patmos da Polícia Federal.O mundo de Aécio desabou literalmente. De acordo com a revista Veja, o político não quer falar com ninguém [?] atende pouquíssimas ligaç?es em seu celular (algo óbvio, já que o aparelho está grampeado pela PF) e tem alternado entre crises de choro e várias ?talagadas? de uísque.",https://afolhabrasil.com.br/politica/aecio-chora-muito-e-tem-medo-de-ir-para-cadeia/,
10,false,pt,webpage,political,2017,Veja aqui o telefone e o e-mail de Gilmar Mendes,Veja aqui o telefone e o e-mail de Gilmar Mendes. Demonstre sua indignação! Gilmar Mendes conseguiu livrar Michel Temer e Dilma Rousseff da condenação. Em seu juízo a chapa Dilma/Temer é honesta e estes dois brasileiros merecem o respeito da nação. Eles estão de posse de seus direitos políticos e poderão voltar em 2018. Dilma já anunciou que se candidatará a senadora da república. Michel Temer pode voltar até como presidente. Não permita que este julgamento vergonhoso passe em branco. Envie mensagens pro e-mail de Gilmar Mendes ou até mesmo telefone para ele manifestando toda sua indignação. Seguem aqui os contatos do ministro que envergonhou o Brasil.MINISTRO GILMAR MENDES Telefone: (61) 3217-4175 E-mail: mgilmar@stf.jus.br E-mail: audienciasgilmarmendes@stf.jus.br,https://afolhabrasil.com.br/politica/veja-aqui-o-telefone-e-e-mail-de-gilmar-mendes-demonstre-sua-indignacao/,
11,false,pt,webpage,political,2017,Mais um ministro de Temer na cadeia.,"Mais um ministro de Temer na cadeia. No dia em que começa a ser julgado por crime eleitoral no TSE Michel Temer acorda com a notícia da prisão de seu ex-ministro e pessoa da mais estrita confiança e proximidade. Pouco a pouco a Polícia Federal está encarcerando as pessoas mais próximas ao presidente. O ex-ministro do Turismo Henrique Eduardo Alves foi preso na manhã desta terça-feira (6) em um desdobramento da operação Lava Jato. O ex-deputado Eduardo Cunha, que está preso em Pinhais, na região metropolitana de Curitiba, é alvo de um novo mandado de prisão preventiva. Ambos são do PMDB e foram presidentes da Câmara dos Deputados. Henrique Alves admitiu à Justiça Federal em Brasília que abriu uma conta bancária na Suíça, mas afirmou que não tinha conhecimento da movimentação de US$ 832,9 mil (ou R$ 2,3 milh?es). A defesa de Alves alegou que ele usou um escritório de advocacia no Uruguai para abrir a conta bancária em 2008.Homem próximo do presidente Michel Temer, também do PMDB, Alves foi ministro do Turismo, pedindo demissão do posto em meio à citação de seu nome em delaç?es da Lava Jato.Os investigados responderão, na medida de suas participaç?es, pelos crimes de corrupção ativa e passiva, além de lavagem de dinheiro.",https://afolhabrasil.com.br/politica/mais-um-ministro-de-temer-na-cadeia/,
12,false,pt,webpage,political,2017,Caiu a máscara do Prof. Villa da Jovem Pan.,"Caiu a máscara do Prof. Villa da Jovem Pan. Vídeo mostra que o Professor Marco Antonio Villa, comentarista da Jovem Pan, é um verdadeiro farsante. O debate com Bolsonaro foi uma farsa que precisa ser revelada. O estúdio do Jornal da Manhã recebeu, nesta terça-feira (23), o deputado Jair Bolsonaro (PSC-RJ) para um debate com o jornalista Marco Antonio Villa sobre a situação do País. Ao invés de debater o professor desfilou argumentos farsantes que caíram por terra após a divulgação deste vídeo.",https://afolhabrasil.com.br/politica/caiu-mascara-do-prof-villa-da-jovem-pan/,
13,false,pt,webpage,political,2017,URGENTE: Janot pede prisão de Aécio Neves,"URGENTE: Janot pede prisão de Aécio Neves. O procurador-geral da República, Rodrigo Janot, pediu nesta segunda-feira (22) ao Supremo Tribunal Federal (STF) a prisão do senador afastado Aécio Neves (PSDB-MG).O advogado Alberto Toron, que faz a defesa de Aécio Neves, informou que aguarda ser intimado sobre o pedido da PGR para apresentar suas contrarraz?es, oportunidade em que demonstrará a impropriedade do pedido. Também afirmou que ingressará no STF com um pedido para revogar o afastamento do senador do mandato por falta de base legal e constitucional. O órgão entende que Aécio foi pego em flagrante por crime inafiançável na tentativa de obstruir as investigaç?es da Operação Lava Jato, com base nas gravaç?es realizadas pelos donos da JBS, entregues na delação premiada da empresa. Janot argumentou que as gravaç?es e interceptaç?es telefônicas demonstrariam que Aécio vem adotando, constante e reiteradamente, estratégias de obstrução de investigaç?es da Operação Lava Jato.",https://afolhabrasil.com.br/politica/urgente-janot-pede-prisao-de-aecio-neves/,
14,false,pt,webpage,political,2017,Delação da Friboi coloca em risco o casamento de Temer.,"Delação da Friboi coloca em risco o casamento de Temer. Além de estar correndo sério risco de sofrer impeachment e ser preso, a delação da Friboi coloca em risco até mesmo o casamento do presidente Temer. Isso é o que afirma Joesley Batista.Perícias iniciais dão conta que a gravação da conversa entre o presidente Temer e o dono da Friboi foi editada em pelo menos 50 trechos antes de ser entregue a Polícia Federal. Michel Temer tentou usar este fato como instrumento de sua defesa, no enanto, Joesley Batista volta a surpreender o Brasil e diz que os trechos editados poderiam colocar em risco seu casamento e também do presidente Michel Temer. Em pelo menos um dos trechos editados, a conversa entre Joesley Batista e Michel Temer girou sobre mulheres. O dono da JBS retirou essa parte para se proteger e, não evidentemente, proteger a relação do presidente com Marcela Temer. Dos 50 minutos de gravação, 38 são conhecidos.",https://afolhabrasil.com.br/politica/delacao-da-friboi-coloca-em-risco-o-casamento-de-temer/,
15,false,pt,webpage,political,2017,Temer oferece feijoada para aliados depois de ser denunciado.,"Temer oferece feijoada para aliados depois de ser denunciado. Em evidente deboche aos brasileiros o presidente Michel Temer convidou seus aliados para uma feijoada no Palácio da Alvorada neste sábado (20/05). Enquanto o Brasil chorava por ver tantos escândalos os denunciados comiam, bebiam e riam da cara do povo.Após fazer um novo pronunciamento, o presidente Michel Temer ofereceu, na tarde deste sábado (20), uma feijoada a políticos aliados, no Palácio da Alvorada. No cardápio além do feijão e da carne de porco havia muita conversa sobre como reverter a pressão popular e da mídia para o impeachment. Passaram por lá, entre outros, o líder do governo no Senado, Romero Jucá (PMDB-RR), os ministros Mendonça Filho (DEM, Educação) e Antonio Imbassahy (PSDB, Secretaria de Governo), o líder do governo na Câmara, Aguinaldo Ribeiro (PP-PI), e o deputado Lúcio Vieira Lima (PMDB-BA).No pronunciamento que fez mais cedo, Temer se defendeu das acusaç?es dos delatores da FRIBOI e voltou a afirmar que não deixará a Presidência. Digo com toda segurança: o Brasil não sairá dos trilhos. Eu continuarei à frente do governo.Vale lembrar que todas estas festas que ele oferece para deputados, senadores e ministros são pagas com dinheiro público. No jantar em que o presidente convidou os deputados para uma conversa sobre a aprovação da PEC do Teto dos Gastos públicos, a conta foi de R$ 53 mil. Quantos meses você precisa trabalhar para somar o valor que eles gastam em um jantar?",https://afolhabrasil.com.br/politica/temer-oferece-feijoada-para-aliados-depois-de-ser-denunciado/,
16,false,pt,webpage,political,2017,Dono da Friboi filmou Temer e Aécio recebendo propina,"Dono da Friboi filmou Temer e Aécio recebendo propina. Os donos da JBS disseram em delação à Procuradoria-Geral da República que gravaram o presidente Michel Temer dando aval para comprar o silêncio do deputado cassado e ex-presidente da Câmara dos Deputados Eduardo Cunha (PMDB-RJ), segundo o colunista do jornal O Globo Lauro Jardim.Segundo o jornal, o empresário Joesley Batista entregou uma gravação feita em março deste ano em que Temer indica o deputado Rodrigo Rocha Lourdes (PMDB-PR) para resolver assuntos da FRIBOI. Posteriormente, Rocha foi filmado recebendo uma * mala com R$ 500 mil * enviados por Joesley. Em outra gravação, também de março, o empresário diz a Temer que estava dando a Eduardo Cunha e ao operador Lúcio Funaro uma mesada para que permanecessem calados na prisão. Diante dessa informação, * Temer diz, na gravação: tem que manter isso, viu? * Aécio Neves foi gravado pedindo R$ 2 milh?es * a Joesley. O dinheiro foi entregue a um primo do presidente do PSDB, numa cena devidamente filmada pela Polícia Federal. A PF rastreou o caminho dos reais. Descobriu que eles foram depositados numa empresa do senador Zeze Perrella (PSDB-MG).",https://afolhabrasil.com.br/politica/dono-da-friboi-filmou-temer-e-aecio-recebendo-propina/,
17,false,pt,webpage,political,2017,Veja o trecho que Moro disse a Lula que ele já está condenado,"Veja o trecho que Moro disse a Lula que ele já está condenado. O ex-presidente Luís Inácio Lula da Silva provocou o juiz federal Sergio Moro e teve a resposta mais dura que poderia ouvir. Moro disse a ele em alto e bom som porque ele já está condenado. lavagem de dinheiro necessariamente ocorre a ocultação de patrimônio. Foram 5 horas de depoimento mas em menos de 1 minuto o recado foi dado como se pode notar neste momento da audiência. Cabe agora ao ex-presidente usar seus últimos momentos de liberdade. Lula: Dr. Moro, como um cidadão compra um apartamento que vale dez e depois declarou no Imposto de Renda cinco anos seguidos e depois aparece um apartamento que vale vinte sem nenhuma explicação?Moro: Mas, senhor ex-presidente, a questão posta pelo Ministério Público na denúncia é evidentemente que teria havido corrupção e lavagem, e lavagem de dinheiro necessariamente ocorre a ocultação de patrimônioOu seja, a tese do não está no meu nome não é meu caiu por terra. O juiz Moro deixou claro que este argumento não será aceito e a tentativa de ocultação de patrimônio já foi criminalizada.A audiência de ontem foi o último momento do processo. Agora cabe ao juiz Sergio Moro redigir e anunciar seu veredito. Pelo que foi posto neste embate a liberdade de Lula está com os dias contados.",https://afolhabrasil.com.br/politica/veja-o-trecho-que-moro-disse-lula-que-ele-ja-esta-condenado/,
18,false,pt,webpage,political,2017,Lula está passando mal e pode ser internado.,"Lula está passando mal e pode ser internado. De acordo com relatos dos correligionários mais próximos do ex-presidente Luiz Inácio Lula da Silva, o petista estaria vivenciando uma crise de ansiedade agravada por picos de hipertensão arterial. A defesa estuda a possibilidade de pedir o adiamento da audiência em virtude do mal estar de Lula.Assessores mais próximos ao ex-presidente Lula estão muito preocupados com seu estado de saúde que ainda dentro do jatinho que o conduziu para Curitiba, já demonstrava quadro de aceleração do batimento cardíaco, tontura e náusea. Um exame preliminar diagnosticou que sua pressão arterial alcançou nível alarmante de 17 x 10. A audiência com o juiz federal Sergio Moro está agendada para as 14h. Caso sua crise de ansiedade não seja atenuada por medicamentos ele deverá seguir de UTI aérea para o Hospital Sírio Libanês em São Paulo. O temor de familiares é que este pico em sua pressão arterial desencadeie um Acidente Vascular Cerebral (AVC).",https://afolhabrasil.com.br/politica/lula-esta-passando-mal-e-pode-ser-internado/,
19,false,pt,webpage,political,2017,Cartório se recusa a registrar criança com o nome de Lula da Silva,"Cartório se recusa a registrar criança com o nome de Lula da Silva. Um casal morador de Vitória, capital do estado do Espírito Santo, foi impedido pelo tabelião de um dos mais tradicionais cartórios do estado a registrar seu filho com o nome do ex-presidente Lula.Um jovem casal onde o marido tem 23 anos e a esposa 19, busca na Justiça o direito de registrar o filho com um nome que homenageia o ex-presidente Luiz Inácio Lula da Silva. Os pais da criança coincidentemente possuem o sobrenome Silva, e desejavam registrar o bebê com o nome Lula da Silva. O tabelião do cartório (que terá seu nome preservado pelo sigilo de Justiça) justificou a negativa afirmando que ?o nome da criança, neste caso, está associado a um personagem da política, isso poderia expor a criança ao bullying e a violências físicas e psicológicas. Segundo o advogado familiar Ricardo Coelho Neves Alcântara, uma lei criada em 1973 prevê que cartorários não possam registrar nomes que exp?em a pessoa ao ridículo. De acordo com ele, o nome Lula da Silva poderia render ao menino um constrangimento enorme caso aconteça a condenação do ex-presidente.A legislação diz, porém, que os pais da criança que se sentirem insatisfeitos com a proibição do nome que eles gostariam de dar podem recorrer da decisão dos cartórios. Um processo administrativo, sem custo algum, pode ser aberto pelos responsáveis pela criança. Após isso, o juiz decide se os nomes podem ser registrados, disse o Dr. Neves Alcântara.Os pais da criança informaram que se for preciso irão até ao Supremo Tribunal Federal para prestar esta homenagem ao maior presidente da história da América Latina. Tá na cara que este tabeliãozinho de merda é um direitista fã de Bolsonaro.Você acredita que Lula da Silva é um nome que traria constrangimentos ao seu filho?",https://afolhabrasil.com.br/politica/cartorio-se-recusa-registrar-crianca-com-o-nome-de-lula-da-silva/,
20,false,pt,webpage,political,2017,Médico afirma que Lula esta com síndrome da amnésia e entra com pedido de proteção ao paciente. ,"Médico afirma que Lula esta com síndrome da amnésia e entra com pedido de proteção ao paciente. Em uma coletiva exclusiva, o medico de Lula apresentou um laudo que comprova que o ex-presidente está sofrendo de amnésia crônica. O médico afirma que Lula nunca mentiu quando disse que não sabia de nada, pois na verdade por conta da doença ele não sabia mesmo ?ele podia até saber, mas não lembrava?.O médico também explicou que pessoas com o nível em Lula se encontra costuma-se esquecer de dados importantes de sua própria vida, assim como seus próprios familiares.",http://www.thejornalbrasil.com.br/2017/06/medico-afirma-que-lula-esta-com.html,
